{
  "site": "https://stkat-philly.solutiosoftware.com",
  "source": "StKat-Philly School Menu.pdf",
  "menu_spec_file": "stkat-philly-menu-spec.json",
  "generated": "2026-07-08",
  "derived_at": "2026-07-08T20:07:44.907Z",
  "entries": [
    {
      "node_key": "mainmenu:Home",
      "kind": "single_article",
      "title": "Home",
      "menu_path": "Home",
      "category": "Page Content",
      "content_source": "existing",
      "spec_notes": "No annotation given; treated as the site homepage.",
      "instructions": "Per 'Solutio Building Notes' (PDF p.1), the homepage should: include a digital calendar; include Virtus/Safe Environment information somewhere on the page; include contact information; include an example mockup with social media (Facebook); use the tagline 'Scholars Today, Leaders Tomorrow'. Quicklinks module referenced in the PDF (Parish, Parent Resources, Facts, Enrollment, Donate) appears to live on/near the homepage as well.",
      "source_url": "",
      "copy": "Scholars Today, Leaders Tomorrow",
      "assets": [
        "Facebook icon/link"
      ],
      "features": [
        {
          "kind": "calendar-embed",
          "kb_ref": "kb/calendar-feed",
          "notes": "Digital calendar required per Solutio Building Notes; feed link not yet provided (see News & Communication 'Calendar' open question)."
        },
        {
          "kind": "social-media-mockup",
          "kb_ref": "kb/elfsight",
          "notes": "PDF requests an example mockup incorporating a social media (Facebook) feed on the homepage."
        }
      ],
      "status": "filled",
      "notes": "Quicklinks (Parish, Parent Resources, Facts, Enrollment, Donate) are assumed to be a homepage/module element, not a separate content page."
    },
    {
      "node_key": "mainmenu:About St. Katherine/Contact Us & Directions",
      "kind": "single_article",
      "title": "Contact Us & Directions",
      "menu_path": "About St. Katherine / Contact Us & Directions",
      "category": "Page Content",
      "content_source": "pull",
      "instructions": "Pull from current website (contact information and directions).",
      "source_url": "TBD",
      "copy": "",
      "assets": [],
      "features": [],
      "status": "needs_input",
      "notes": ""
    },
    {
      "node_key": "mainmenu:About St. Katherine/Mission & History",
      "kind": "single_article",
      "title": "Mission & History",
      "menu_path": "About St. Katherine / Mission & History",
      "category": "Page Content",
      "content_source": "pull",
      "instructions": "Pull from current website.",
      "source_url": "TBD",
      "copy": "",
      "assets": [],
      "features": [],
      "status": "needs_input",
      "notes": ""
    },
    {
      "node_key": "mainmenu:About St. Katherine/Our Beliefs",
      "kind": "single_article",
      "title": "Our Beliefs",
      "menu_path": "About St. Katherine / Our Beliefs",
      "category": "Page Content",
      "content_source": "pull",
      "instructions": "Pull from current website.",
      "source_url": "TBD",
      "copy": "",
      "assets": [],
      "features": [],
      "status": "needs_input",
      "notes": ""
    },
    {
      "node_key": "mainmenu:About St. Katherine/About our Patroness",
      "kind": "single_article",
      "title": "About our Patroness",
      "menu_path": "About St. Katherine / About our Patroness",
      "category": "Page Content",
      "content_source": "pull",
      "instructions": "Pull from current website.",
      "source_url": "TBD",
      "copy": "",
      "assets": [],
      "features": [],
      "status": "needs_input",
      "notes": ""
    },
    {
      "node_key": "mainmenu:About St. Katherine/Our Staff",
      "kind": "grid_landing",
      "title": "Our Staff",
      "menu_path": "About St. Katherine / Our Staff",
      "category": "Page Content",
      "content_source": "generate",
      "spec_notes": "Staff listing (image, name, position, email). Only partial extension info given (sr ext 200, mccormick 223, betty 221, janice 220) — full roster needed. Always classified as category_grid per staff page convention.",
      "instructions": "Staff grid: each entry needs image, name, position, and email. PDF supplies only partial phone-extension data: Sr. [name] ext. 200, Mccormick ext. 223, Betty ext. 221, Janice ext. 220 — full names, positions, photos, and emails for the complete staff roster still needed from the client.",
      "source_url": "",
      "copy": "",
      "assets": [
        "staff photos (per staff member, TBD)"
      ],
      "features": [
        {
          "kind": "staff-grid",
          "kb_ref": "kb/staff-grid",
          "notes": "Grid of staff image/name/position/email."
        }
      ],
      "status": "needs_input",
      "notes": ""
    },
    {
      "node_key": "mainmenu:About St. Katherine/Our Graduates",
      "kind": "single_article",
      "title": "Our Graduates",
      "menu_path": "About St. Katherine / Our Graduates",
      "category": "Page Content",
      "content_source": "pull",
      "instructions": "Pull from current website.",
      "source_url": "TBD",
      "copy": "",
      "assets": [],
      "features": [],
      "status": "needs_input",
      "notes": ""
    },
    {
      "node_key": "mainmenu:About St. Katherine/Alumni/Stay in Touch",
      "kind": "single_article",
      "title": "Stay in Touch",
      "menu_path": "About St. Katherine / Alumni / Stay in Touch",
      "category": "Page Content",
      "content_source": "pull",
      "instructions": "Pull from current website (Alumni section).",
      "source_url": "TBD",
      "copy": "",
      "assets": [],
      "features": [],
      "status": "needs_input",
      "notes": ""
    },
    {
      "node_key": "mainmenu:About St. Katherine/Alumni/Alumni Basketball Tournament",
      "kind": "single_article",
      "title": "Alumni Basketball Tournament",
      "menu_path": "About St. Katherine / Alumni / Alumni Basketball Tournament",
      "category": "Page Content",
      "content_source": "pull",
      "instructions": "Pull from current website (Alumni section).",
      "source_url": "TBD",
      "copy": "",
      "assets": [],
      "features": [],
      "status": "needs_input",
      "notes": ""
    },
    {
      "node_key": "mainmenu:About St. Katherine/Alumni/SKS Quizzo",
      "kind": "single_article",
      "title": "SKS Quizzo",
      "menu_path": "About St. Katherine / Alumni / SKS Quizzo",
      "category": "Page Content",
      "content_source": "pull",
      "instructions": "Pull from current website (Alumni section).",
      "source_url": "TBD",
      "copy": "",
      "assets": [],
      "features": [],
      "status": "needs_input",
      "notes": ""
    },
    {
      "node_key": "mainmenu:News & Communication/Principal's Corner",
      "kind": "single_article",
      "title": "Principal's Corner",
      "menu_path": "News & Communication / Principal's Corner",
      "category": "Page Content",
      "content_source": "generate",
      "spec_notes": "Doc notes 'this is news'; kept as a single named page rather than a grid since it is not a listing of many entries.",
      "instructions": "PDF annotates this item only as '(this is news)' — no further direction or copy given.",
      "source_url": "",
      "copy": "",
      "assets": [],
      "features": [],
      "status": "needs_input",
      "notes": "Ambiguous whether this should be a recurring news/updates feed or a single principal's-message page; needs client clarification."
    },
    {
      "node_key": "mainmenu:Admissions/Why St. Katherine of Siena?",
      "kind": "single_article",
      "title": "Why St. Katherine of Siena?",
      "menu_path": "Admissions / Why St. Katherine of Siena?",
      "category": "Page Content",
      "content_source": "pull",
      "instructions": "Pull from current website.",
      "source_url": "TBD",
      "copy": "",
      "assets": [],
      "features": [],
      "status": "needs_input",
      "notes": ""
    },
    {
      "node_key": "mainmenu:Admissions/Spiritual Life",
      "kind": "single_article",
      "title": "Spiritual Life",
      "menu_path": "Admissions / Spiritual Life",
      "category": "Page Content",
      "content_source": "pull",
      "instructions": "Pull from current website.",
      "source_url": "TBD",
      "copy": "",
      "assets": [],
      "features": [],
      "status": "needs_input",
      "notes": ""
    },
    {
      "node_key": "mainmenu:Admissions/Admission Requirements",
      "kind": "single_article",
      "title": "Admission Requirements",
      "menu_path": "Admissions / Admission Requirements",
      "category": "Page Content",
      "content_source": "pull",
      "spec_notes": "Pull content specifically from https://sksphila.com/primary-open-house (not the homepage).",
      "instructions": "Pull content specifically from https://sksphila.com/primary-open-house per PDF (p.2).",
      "source_url": "https://sksphila.com/primary-open-house",
      "copy": "",
      "assets": [],
      "features": [],
      "status": "needs_input",
      "notes": ""
    },
    {
      "node_key": "mainmenu:Admissions/New Student Enrollment",
      "kind": "single_article",
      "title": "New Student Enrollment",
      "menu_path": "Admissions / New Student Enrollment",
      "category": "Page Content",
      "content_source": "pull",
      "spec_notes": "Pull content specifically from https://sksphila.com/admissions (not the homepage).",
      "instructions": "Pull content specifically from https://sksphila.com/admissions per PDF (p.2).",
      "source_url": "https://sksphila.com/admissions",
      "copy": "",
      "assets": [],
      "features": [],
      "status": "needs_input",
      "notes": "",
      "source_file": "stkat-philly-source/15-new-student-enrollment.md"
    },
    {
      "node_key": "mainmenu:Admissions/Re-Enrollment",
      "kind": "single_article",